<?xml version="1.0" encoding="UTF-8"?>
<project
  xmlns:xsi="http://www.w3.org/2001/XMLSchema-instance"
  xsi:noNamespaceSchemaLocation="maven-project.xsd">

  <pomVersion>1</pomVersion>
  <id>astrogrid-ogsa-echo</id>
  <name>AstroGrid OGSA Echo</name>

  <currentVersion>HEAD</currentVersion>
  
  <organization>
    <name>AstroGrid</name>
    <url>http://www.astrogrid.org</url>
    <logo>http://www.astrogrid.org/images/AGlogo</logo>
  </organization>

  <inceptionYear>2002</inceptionYear>
  <package>org.astrogrid</package>
  <logo>http://www.astrogrid.org/images/AGlogo</logo>

  <shortDescription>AstroGrid OGSA Echo Gridservice</shortDescription>

	<!--
  <siteDirectory>/var/www/www/maven/build/datacenter</siteDirectory>
  -->

  <repository>
    <connection>
      scm:cvs:pserver:anoncvs@cvs.astrogrid.org:/devel:astrogrid/ogsa/echo
    </connection>
    <developerConnection>
      scm:cvs:ext:${maven.username}@cvs.astrogrid.org:/devel:astrogrid/ogsa/echo
    </developerConnection>
  </repository>

  <developers>
    <developer>
      <name>Guy Rixon</name>
      <id>gtr</id>
      <email>gtr@ast.cam.ac.uk</email>
    </developer>

  </developers>

  <dependencies>

    <dependency>
      <id>ogsa</id>
      <version>3.0</version>
    </dependency>

    <dependency>
      <id>saaj</id>
      <version>OGSA3.0</version>
    </dependency>

    <dependency>
      <id>cog-jglobus</id>
      <version>OGSA3.0</version>
    </dependency>

    <dependency>
      <id>xmlParserAPIs</id>
      <version>OGSA3.0</version>
    </dependency>

    <dependency>
      <id>jaxrpc</id>
      <version>OGSA3.0</version>
    </dependency>

    <dependency>
      <id>cog-axis</id>
      <version>OGSA3.0</version>
    </dependency>

    <dependency>
      <id>axis</id>
      <version>OGSA3.0</version>
    </dependency>

  </dependencies>

  <build>

    <sourceDirectory>build/src/java</sourceDirectory>
<!--
    <sourceDirectory>src/java</sourceDirectory>
    <unitTestSourceDirectory>test/java</unitTestSourceDirectory>

    <unitTest>
      <includes>
        <include>**/*Test.java</include>
      </includes>

      <resources>
        <resource>
          <directory>${basedir}/test/java</directory>
          <includes>
            <include>**/*.xml</include>
	    <include>**/*.properties</include>
          </includes>
        </resource>
      </resources>
    </unitTest>
	 -->

    <resources>
    	<resource><!-- config files -->
		<directory>${basedir}/src/java</directory>
		<includes>
			<include>**/*.xml</include>
			<include>**/*.properties</include>
		</includes>
	</resource>
	<resource> <!-- schemas  - may be needed for validation -->
		<directory>${basedir}</directory>
		<includes>
			<include>schema/*.xsd</include>
			<include>schema/*.dtd</include>
		</includes>
	</resource>
	<resource> <!-- webservice related files -->
		<directory>${basedir}</directory>
		<includes>
			<include>wsdl/*.wsdl</include>
			<include>wsdd/*.wsdd</include>
		</includes>
	</resource>
    </resources>

  </build>

  <reports>
    <report>
      maven-changelog-plugin
    </report>
    <report>
      maven-changes-plugin
    </report>
    <report>
      maven-checkstyle-plugin
    </report>
    <report>
      maven-clover-plugin
    </report>
    <report>
      maven-developer-activity-plugin
    </report>
    <report>
      maven-file-activity-plugin
    </report>
    <report>
      maven-javadoc-plugin
    </report>
    <report>
      maven-jdepend-plugin
    </report>
    <report>
      maven-junit-report-plugin
    </report>
    <report>
      maven-jxr-plugin
    </report>
    <report>
      maven-license-plugin
    </report>
    <report>
      maven-linkcheck-plugin
    </report>
    <report>
      maven-pmd-plugin
    </report>
    <report>
      maven-tasklist-plugin
    </report>
    <report>
      maven-simian-plugin
    </report>
  </reports>
</project>




