<?xml version="1.0" encoding="UTF-8"?>

<!-- $Id: project.xml,v 1.2 2005/02/15 18:31:57 mch Exp $ -->

<project xmlns:xsi="http://www.w3.org/2001/XMLSchema-instance"

    xsi:noNamespaceSchemaLocation="../../maven-base/xsd/maven-project.xsd">

    <!--will eventually extend from /base when Maven RC3 installed-->

    <extend>${basedir}/../../maven-base/project.xml</extend>

    <currentVersion>${astrogrid.slinger.version}</currentVersion>

    <id>astrogrid-slinger-webnode</id>

    <name>Astrogrid Slinger WebNode Package</name>

    <description>Webapp wrapper for Slinger</description>

    <shortDescription>AstroGrid Slinger Webapp</shortDescription>

    <dependencies>

        <dependency>
            <artifactId>astrogrid-common</artifactId>
            <groupId>org.astrogrid</groupId>
            <version>${astrogrid.common.version}</version>
        </dependency>

        <dependency>
            <artifactId>astrogrid-slinger-api</artifactId>
            <groupId>org.astrogrid</groupId>
            <version>${astrogrid.slinger.version}</version>
        </dependency>

        <dependency>
            <artifactId>astrogrid-slinger-xml</artifactId>
            <groupId>org.astrogrid</groupId>
            <version>${astrogrid.slinger.version}</version>
        </dependency>


         <!-- for logging -->
        <dependency>
            <artifactId>log4j</artifactId>
            <groupId>log4j</groupId>
            <version>1.2.4</version>
        </dependency>

        <dependency>
            <artifactId>commons-logging</artifactId>
            <groupId>commons-logging</groupId>
            <version>1.0.3</version>
        </dependency>

       <!-- servlet support -->
       <dependency>
         <id>servletapi</id>
         <version>2.3</version>
       </dependency>


    </dependencies>

</project>







