<?xml version="1.0" encoding="UTF-8"?>
<!--+
    |
    | <cvs:source>$Source: /Users/pharriso/Work/ag/repo/git/astrogrid-mirror/astrogrid/filestore/maven/project.xml,v $</cvs:source>
    | <cvs:author>$Author: jdt $</cvs:author>
    | <cvs:date>$Date: 2004/12/13 14:49:21 $</cvs:date>
    | <cvs:version>$Revision: 1.9 $</cvs:version>
    | <cvs:log>
    |   $Log: project.xml,v $
    |   Revision 1.9  2004/12/13 14:49:21  jdt
    |   Some pruning, that factors out more of the commonality into maven-base
    |
    |   Revision 1.8  2004/11/25 00:19:20  jdt
    |   Merge from dave-dev-200410061224-200411221626
    |
    |   Revision 1.7  2004/11/23 18:40:50  jdt
    |   Merges from  BLD_JDT_648.  The long awaited move to versioned jars and wars.  Fingers crossed.  See:
    |   http://software.astrogrid.org/developerdocs/developmentprocess.html
    |
    |   Revision 1.6.24.1  2004/11/12 00:45:52  jdt
    |   Switched to use fixed version numbers, defined in a properties file
    |
    |   Revision 1.6  2004/09/17 06:57:10  dave
    |   Added commons logging to FileStore.
    |   Updated logging properties in Community.
    |   Fixed bug in AGINAB deployment.
    |   Removed MySpace tests with hard coded grendel address.
    |
    |   Revision 1.5.32.1  2004/09/17 01:08:36  dave
    |   Updated debug to use commons logging API ....
    |
    |   Revision 1.5  2004/08/18 19:00:01  dave
    |   Myspace manager modified to use remote filestore.
    |   Tested before checkin - integration tests at 91%.
    |
    |   Revision 1.4.2.1  2004/07/27 15:50:54  dave
    |   Changed tabs to spaces
    |
    |   Revision 1.4  2004/07/27 12:16:07  jdt
    |   whoopsie
    |
    |   Revision 1.3  2004/07/27 11:46:27  jdt
    |   Projects MUST extend maven-base and not override <currentVersion>
    |
    |   Revision 1.2  2004/07/14 13:50:29  dave
    |   Merged development branch, dave-dev-200406301228, into HEAD
    |
    |   Revision 1.1.2.1  2004/07/05 04:50:29  dave
    |   Created initial FileStore components
    |
    | </cvs:log>
    |
    +-->
<project
    xmlns:xsi="http://www.w3.org/2001/XMLSchema-instance"
    xmlns:ant="jelly:ant"
    xsi:noNamespaceSchemaLocation="maven-project.xsd">
    <!--+
        | Extend the global astrogrid project.xml.
        +-->
    <extend>../../maven-base/project.xml</extend>
    <currentVersion>${astrogrid.filestore.version}</currentVersion>

    <!--+
        | The Java package name of the project.
        +-->
    <package>org.astrogrid.filestore</package>

    <!--+
        | The external libraries required to build our components.
        +-->
    <dependencies>
        <!--+
            | The Axis webapp war file.
            +-->
        <dependency>
            <groupId>axis</groupId>
            <artifactId>axis</artifactId>
            <version>1.1</version>
            <type>war</type>
            <url>http://ws.apache.org/axis/index.html</url>
        </dependency>
        <!--+
            | JUnit library for test tasks.
            +-->
        <dependency>
            <groupId>junit</groupId>
            <artifactId>junit</artifactId>
            <version>3.8.1</version>
            <type>jar</type>
            <url>http://www.junit.org/</url>
        </dependency>
        <!--+
            | Ant library for test tasks.
            +-->
        <dependency>
            <groupId>ant</groupId>
            <artifactId>ant</artifactId>
            <version>1.5.3-1</version>
            <type>jar</type>
            <url>http://ant.apache.org/</url>
        </dependency>
        <!--+
            | Commons logging API.
            +-->
        <dependency>
            <artifactId>commons-logging</artifactId>
            <groupId>commons-logging</groupId>
            <version>1.0.3</version>
            <properties>
                <war.bundle>true</war.bundle>
            </properties>
        </dependency>
        <!--+
            | Log4j toolkit.
            +-->
        <dependency>
            <groupId>log4j</groupId>
            <artifactId>log4j</artifactId>
            <version>1.2.8</version>
            <properties>
                <war.bundle>true</war.bundle>
            </properties>
        </dependency>
    </dependencies>
</project>
