<?xml version="1.0" encoding="UTF-8"?>
<project
  xmlns:xsi="http://www.w3.org/2001/XMLSchema-instance"
  xsi:noNamespaceSchemaLocation="maven-project.xsd">

  <extend>../maven-base/project.xml</extend>
  
  <artifactId>astrogrid-security</artifactId>
  <currentVersion>${astrogrid.security.version}</currentVersion>
  <name>AstroGrid security facade</name>

  <shortDescription>A collection of APIs abstracting security in web services.</shortDescription>
  
  <description>
    <![CDATA[
    <p>
    The security-facade package implements a single-sign-on (SSO) authentication 
    system between SOAP clients and SOAP services. Messages sent with the aid of 
    this package are annotated with SSO credentials in the SOAP headers. Messages
    received by services using this package are authenticated using the credentials
    in the message.
    </p>
  	<p>
  	The current implementation is based on Axis and WSS4J. It enforces digital
  	signatures on requests from clients to services in line with the emerging
  	IVOA standard for SSO.
  	</p>
    <p>
    The facade hides details of the authentication from the client and service code.
  	Services alter their WSDD configuration to use the facade. Clients call the
  	facade's APIs, with the Axis-specific security calls encapsulated in the axis-specific
  	delegates.
  	</p>
  	<p>
  	At present, this implementation reads in credentials from files local to the
  	clients. It does not use the AstroGrid community-services and does not
  	depend on other AstroGrid components.
  	</p>
    ]]>
  </description>
  
  <dependencies>
     
    <dependency>
      <groupId>axis</groupId>
      <type>jar</type>
      <artifactId>axis</artifactId>
      <version>1.2.1</version>
    </dependency>

    <dependency>
      <groupId>saaj</groupId>
      <type>jar</type>
      <artifactId>saaj</artifactId>
      <version>unknown</version>
      <jar>saaj.jar</jar>
    </dependency>

    <dependency>
      <groupId>commons-logging</groupId>
      <type>jar</type>
      <artifactId>commons-logging</artifactId>
      <version>1.0.3</version>
    </dependency>

    <dependency>
      <groupId>commons-discovery</groupId>
      <type>jar</type>
      <artifactId>commons-discovery</artifactId>
      <version>20030211.213356</version>
    </dependency>
    
    <dependency>
      <groupId>castor</groupId>
      <type>jar</type>
      <artifactId>castor-xml</artifactId>
      <version>0.9.5</version>
      <jar>castor-0.9.5-xml.jar</jar>
    </dependency>
    
    <dependency>
      <groupId>jaxrpc-api</groupId>
      <type>jar</type>
      <artifactId>jaxrpc-api</artifactId>
      <version>1.0.3</version>
    </dependency>
    
    <dependency>
      <groupId>xml-apis</groupId>
      <type>jar</type>
      <artifactId>xml-apis</artifactId>
      <version>2.0.2</version>
    </dependency>
    
    <dependency>
      <groupId>wsdl4j</groupId>
      <type>jar</type>
      <artifactId>wsdl4j</artifactId>
      <version>1.0</version>
    </dependency>

    <dependency>
      <groupId>log4j</groupId>
      <type>jar</type>
      <artifactId>log4j</artifactId>
      <version>1.2.8</version>
    </dependency>
      
    <!-- DOM4J is used in the test classes. -->
    <dependency>
      <groupId>dom4j</groupId>
      <type>jar</type>
      <artifactId>dom4j</artifactId>
      <version>1.4</version>
    </dependency>
  	
  	<dependency>
  		<groupId>wss4j</groupId>
  		<type>jar</type>
  		<artifactId>wss4j</artifactId>
  		<version>1.0a</version>
  	</dependency>
  	
  	<dependency>
  		<groupId>xmlsec</groupId>
  		<type>jar</type>
  		<artifactId>xmlsec</artifactId>
  		<version>1.2.1</version>
  	</dependency>
    
  	<dependency>
  		<groupId>opensaml</groupId>
  		<type>jar</type>
  		<artifactId>opensaml</artifactId>
  		<version>1.1b</version>
  	</dependency>
  	
  	<dependency>
  		<groupId>bouncycastle</groupId>
  		<type>jar</type>
  		<artifactId>bcprov-jdk14</artifactId>
  		<version>129</version>
  	</dependency>
  	
  	<dependency>
  		<groupId>xalan</groupId>
  		<type>jar</type>
  		<artifactId>xalan</artifactId>
  		<version>2.6.0</version>
  	</dependency>
  	
  	<dependency>
  		<groupId>sun</groupId>
  		<type>jar</type>
  		<artifactId>mail</artifactId>
  		<version>1.3.1</version>
  	</dependency>
  	
  	<dependency>
  		<groupId>activation</groupId>
  		<type>jar</type>
  		<artifactId>activation</artifactId>
  		<version>1.0.2</version>
  	</dependency>
  	
  </dependencies>
	

  <build>
    <sourceDirectory>src/java</sourceDirectory>
    <unitTestSourceDirectory>test/java</unitTestSourceDirectory>

    <unitTest>
      <includes>
        <include>**/*Test.java</include>
      </includes>

      <resources>
        <resource>
          <directory>${basedir}/test/properties</directory>
          <includes>
 	    			<include>*.properties</include>
          </includes>
        </resource>
      </resources>
    </unitTest>

  </build>


</project>
