<?xml version="1.0" encoding="UTF-8"?>
<!--+
    |
    | <cvs:source>$Source: /Users/pharriso/Work/ag/repo/git/astrogrid-mirror/astrogrid/filestore/stress/project.xml,v $</cvs:source>
    | <cvs:author>$Author: clq2 $</cvs:author>
    | <cvs:date>$Date: 2005/09/06 12:45:22 $</cvs:date>
    | <cvs:version>$Revision: 1.2 $</cvs:version>
    | <cvs:log>
    |   $Log: project.xml,v $
    |   Revision 1.2  2005/09/06 12:45:22  clq2
    |   dave-dev-200507251101
    |
    |   Revision 1.1.2.1  2005/08/04 12:29:52  dave
    |   Added large data (1Gbyte) stress test.
    |   Added JDK 1.5 fix to FileStoreOutputStream.
    |
    | </cvs:log>
    |
    +-->
<project
  xmlns:xsi="http://www.w3.org/2001/XMLSchema-instance"
  xsi:noNamespaceSchemaLocation="maven-project.xsd">

    <!--+
        | Extend the common project descriptor.
        +-->
    <extend>../maven/project.xml</extend>

    <!--+
        | The short name of the project.
        +-->
    <id>astrogrid-filestore-stress</id>

    <!--+
        | The full name of the project.
        +-->
    <name>FileStore stress tests</name>

    <!--+
        | A short description of the project.
        | The short description should be limited to a single line.
        +-->
    <shortDescription>
        FileStore stress tests, designed to be run against a live service installed in tomcat.
    </shortDescription>

    <!--+
        | A detailed description of the project.
        | This is used to generate the front page of the projects web site. 
        +-->
    <description>
        <![CDATA[
            FileStore stress tests, designed to be run against a live service installed in tomcat.
        ]]>
    </description>


    <!--+
        | The external libraries required to build our component.
        +-->
    <dependencies>
        <!--+
            | The AstroGrid common components.
            +-->
        <dependency>
            <groupId>${pom.groupId}</groupId>
            <artifactId>astrogrid-common</artifactId>
            <version>${astrogrid.common.version}</version>
            <type>jar</type>
            <url>http://www.astrogrid.org/</url>
        </dependency>
        <!--+
            | The FileStore components.
            +-->
        <dependency>
            <groupId>${pom.groupId}</groupId>
            <artifactId>astrogrid-filestore-common</artifactId>
            <version>${astrogrid.filestore.version}</version>
            <type>jar</type>
            <url>http://www.astrogrid.org/</url>
        </dependency>
        <dependency>
            <groupId>${pom.groupId}</groupId>
            <artifactId>astrogrid-filestore-client</artifactId>
            <version>${astrogrid.filestore.version}</version>
            <type>jar</type>
            <url>http://www.astrogrid.org/</url>
        </dependency>
        <!--+
            | The Registry components.
            +-->
        <dependency>
            <groupId>${pom.groupId}</groupId>
            <artifactId>astrogrid-registry-common</artifactId>
            <version>${astrogrid.registry.version}</version>
            <type>jar</type>
            <url>http://www.astrogrid.org/</url>
            <properties>
                <jar.fileset>true</jar.fileset>
            </properties>
        </dependency>
        <dependency>
            <groupId>${pom.groupId}</groupId>
            <artifactId>astrogrid-registry-client-lite</artifactId>
            <version>${astrogrid.registry.version}</version>
            <type>jar</type>
            <url>http://www.astrogrid.org/</url>
            <properties>
                <jar.fileset>true</jar.fileset>
            </properties>
        </dependency>
        <!--+
            | The commons HttpClient library.
            +-->
        <dependency>
            <id>commons-httpclient</id>
            <version>3.0-rc3</version>
            <url>http://jakarta.apache.org/commons/httpclient/3.0/</url>
            <type>jar</type>
            <properties>
                <jar.fileset>true</jar.fileset>
            </properties>
        </dependency>

    </dependencies>

    <!--+
        | The build properties for our project.
        +-->
    <build>
        <!--+
            | The location of our Java source code.
            +-->
        <sourceDirectory>src/java</sourceDirectory>
        <!--+
            | The location of our JUnit source code.
            +-->
        <unitTestSourceDirectory>src/junit</unitTestSourceDirectory>
        <!--+
            | Our JUnit test classes.
            +-->
        <unitTest>
            <!--+
                | Which tests to include.
                +-->
            <includes>
                <include>**/*TestCase.java</include>
            </includes>
            <!--+
                | The resources for our tests.
            <resources>
                <resource>
                </resource>
            </resources>
                +-->
        </unitTest>
    </build>

</project>
